{
  "entry_id": "acl-001",
  "subject_did": "did:web:application.example",
  "vta_did": "did:web:vta.example",
  "role": "application",
  "capabilities": [
    "credential-write",
    "sign-trust-task"
  ],
  "allowed_contexts": [
    "ctx-production-issuer"
  ],
  "consumer": {
    "kind": "service",
    "service_kind": "api-service"
  },
  "granted_at": "2026-06-26T00:00:00Z",
  "granted_by": "did:web:admin.example",
  "expires_at": "2026-09-26T00:00:00Z",
  "status": "active",
  "version": "1.0",
  "step_up_required": true,
  "step_up_mode": "hardware-key",
  "tsmm_authority_ref": {
    "uri": "https://example.org/tsmm/authority/vta-admin",
    "artifact_id": "tsmm-authority-vta-admin"
  },
  "tsmm_role_ref": {
    "uri": "https://example.org/tsmm/roles/application",
    "artifact_id": "tsmm-role-application"
  },
  "tsmm_effect_ref": {
    "uri": "https://example.org/tsmm/effects/sign-trust-task",
    "artifact_id": "effect-sign-trust-task"
  },
  "tsmm_trust_boundary_ref": {
    "uri": "https://example.org/tsmm/boundaries/production-vta",
    "artifact_id": "boundary-production-vta"
  },
  "tsmm_policy_ref": {
    "uri": "https://example.org/policies/vta-runtime-policy.json",
    "artifact_id": "policy-vta-runtime"
  }
}
